{
  "$id": "https://github.com/netrunnerdb/netrunner-cards-json/blob/master/schema/v2/printings_schema.json",
  "$schema": "https://json-schema.org/draft/2020-12/schema",
  "type": "array",
  "items": {
    "type": "object",
    "additionalProperties": false,
    "properties": {
      "card_id": {
        "minLength": 1,
        "type": "string"
      },
      "card_set_id": {
        "minLength": 1,
        "type": "string"
      },
      "copy_quantity": {
        "minimum": 1,
        "type": "integer"
      },
      "flavor": {
        "minLength": 1,
        "type": "string"
      },
      "id": {
        "minLength": 1,
        "type": "string"
      },
      "illustrator": {
        "minLength": 1,
        "type": "string"
      },
      "layout_id": {
        "oneOf": [
          {
            "type": "string",
            "enum": ["normal", "flip", "copy", "facade", "progression"]
          },
          {
            "type": "null"
          }
        ]
      },
      "position": {
        "minimum": 1,
        "type": "integer"
      },
      "quantity": {
        "minimum": 1,
        "type": "integer"
      },
      "faces": {
        "oneOf": [
          {
            "type": "array"
          },
          {
            "type": "null"
          }
        ]
      }
    },
    "required": ["card_id", "card_set_id", "id", "position", "quantity"],
    "dependentSchemas": {
      "layout_id": {
        "oneOf": [
          {
            "properties": {
              "layout_id": {
                "oneOf": [
                  {
                    "const": "normal"
                  },
                  {
                    "type": "null"
                  }
                ]
              },
              "faces": {
                "type": "null"
              }
            }
          },
          {
            "properties": {
              "layout_id": {
                "const": "flip"
              },
              "faces": {
                "type": "array",
                "minItems": 1,
                "maxItems": 1,
                "items": {
                  "type": "object"
                }
              }
            },
            "required": ["faces"]
          },
          {
            "properties": {
              "layout_id": {
                "const": "copy"
              },
              "faces": {
                "type": "array",
                "minItems": 1,
                "items": {
                  "type": "object"
                }
              }
            },
            "required": ["faces"]
          },
          {
            "properties": {
              "layout_id": {
                "const": "facade"
              },
              "faces": {
                "type": "array",
                "minItems": 1,
                "items": {
                  "type": "object"
                }
              }
            },
            "required": ["faces"]
          },
          {
            "properties": {
              "layout_id": {
                "const": "progression"
              },
              "faces": {
                "type": "array",
                "minItems": 1,
                "items": {
                  "type": "object"
                }
              }
            },
            "required": ["faces"]
          }
        ]
      }
    }
  }
}
