[
  {
    "card_id": "evidence_collection",
    "card_set_id": "terminal_directive_campaign",
    "id": "14000",
    "illustrator": "Dmitry Burmak",
    "position": 1,
    "quantity": 3
  },
  {
    "card_id": "investigator_inez_delgado_a",
    "card_set_id": "terminal_directive_campaign",
    "id": "14004",
    "illustrator": "PxelSlayer",
    "position": 2,
    "quantity": 3
  },
  {
    "card_id": "lt_todachine",
    "card_set_id": "terminal_directive_campaign",
    "id": "14006",
    "illustrator": "Antonio José Manzanedo",
    "position": 3,
    "quantity": 3
  },
  {
    "card_id": "trojan",
    "card_set_id": "terminal_directive_campaign",
    "id": "14008",
    "illustrator": "Ethan Patrick Harris",
    "position": 4,
    "quantity": 3
  },
  {
    "card_id": "net_watchlist",
    "card_set_id": "terminal_directive_campaign",
    "id": "14023",
    "illustrator": "Adam S. Doyle",
    "position": 5,
    "quantity": 1
  },
  {
    "card_id": "machicolation",
    "card_set_id": "terminal_directive_campaign",
    "id": "14010",
    "illustrator": "Ed Mattinian",
    "position": 6,
    "quantity": 6,
    "layout_id": "copy",
    "copy_quantity": 3,
    "faces": [
      {
        "copy_quantity": 3
      }
    ]
  },
  {
    "card_id": "corporate_oversight",
    "card_set_id": "terminal_directive_campaign",
    "id": "14012",
    "illustrator": "Matt Zeilinger",
    "position": 7,
    "quantity": 6,
    "layout_id": "copy",
    "copy_quantity": 3,
    "faces": [
      {
        "copy_quantity": 3
      }
    ]
  },
  {
    "card_id": "investigator_inez_delgado",
    "card_set_id": "terminal_directive_campaign",
    "id": "14014",
    "illustrator": "Matt Zeilinger",
    "position": 8,
    "quantity": 3
  },
  {
    "card_id": "surveillance_network_key",
    "card_set_id": "terminal_directive_campaign",
    "id": "14018",
    "illustrator": "Michał Miłkowski",
    "position": 9,
    "quantity": 3
  },
  {
    "card_id": "bmi_buffer",
    "card_set_id": "terminal_directive_campaign",
    "id": "14020",
    "illustrator": "Timur Shevtsov",
    "position": 10,
    "quantity": 3
  },
  {
    "card_id": "shadow_team",
    "card_set_id": "terminal_directive_campaign",
    "id": "14022",
    "illustrator": "Adam Schumpert",
    "position": 11,
    "quantity": 3
  },
  {
    "card_id": "security_leak",
    "card_set_id": "terminal_directive_campaign",
    "id": "14009",
    "illustrator": "Jason Juta",
    "position": 12,
    "quantity": 1
  },
  {
    "card_id": "the_masque",
    "card_set_id": "terminal_directive_campaign",
    "id": "14024",
    "illustrator": "PxelSlayer",
    "position": 13,
    "quantity": 6,
    "layout_id": "copy",
    "copy_quantity": 3,
    "faces": [
      {
        "copy_quantity": 3
      }
    ]
  },
  {
    "card_id": "sneakdoor_prime",
    "card_set_id": "terminal_directive_campaign",
    "id": "14026",
    "illustrator": "Dmitry Prosvirnin",
    "position": 14,
    "quantity": 6,
    "layout_id": "copy",
    "copy_quantity": 3,
    "faces": [
      {
        "copy_quantity": 3
      }
    ]
  }
]
